{
  "id": "genre/hunter-gate",
  "kind": "overlay",
  "version": 1,
  "name": "헌터·게이트 오버레이",
  "lineage": { "base": "kr-webnovel-base" },
  "structure": {
    "cadence": { "progression_event_every_chapters": 3, "cider_every_chapters": 3, "max_frustration_streak": 3 },
    "opening_types_allowed": ["continue_cliffhanger", "in_medias_res", "sharp_dialogue", "status_update", "time_skip_with_tension"]
  },
  "vocabulary": {
    "preferred_terms": ["게이트", "던전", "각성", "각성자", "헌터", "등급", "마수", "마석", "길드", "협회", "레이드", "브레이크", "측정기", "포터"],
    "discouraged_terms": ["마나", "모험가", "용사", "퀘스트"],
    "fixed_spellings": ["헌터협회", "던전 브레이크", "마석"]
  },
  "devices": [
    { "id": "rank_reveal", "description_ko": "등급 공개 장면: 측정기 수치 → 주변 반응 → 당사자의 무심함/충격 순서. 반응은 인물별로 달라야 한다.", "max_per_chapter": 1 },
    { "id": "community_interlude", "description_ko": "게시판/댓글 인터루드. '└' 들여쓰기, 초성체 최소, 한 인터루드 ≤ 8줄.", "format_grammar": "(└ [댓글 한 줄]\\n){2,8}", "max_per_chapter": 1 },
    { "id": "measurement_scene", "description_ko": "측정기 수치는 사실(fact)로 추출됨. 수치가 하락하면 반드시 서술적 이유가 있어야 한다." }
  ],
  "taboos": ["측정 오류 클리셰 2회 이상", "모든 인물이 같은 '등급 충격' 반응", "각성 직후 즉시 S급"],
  "rubric_notes_ko": [
    "액션 명료성: 누가, 어디서, 무엇을 베는지 한 문장 안에서 드러나야 한다.",
    "게시판 인터루드는 실제 커뮤니티 어투(짧고 반말, 비꼼)를 따르되 욕설 표기는 등급 제한을 지킨다."
  ],
  "lint_thresholds": {
    "KL-EXP-02": { "warn": 8, "fail": 12 }
  }
}
